{
  "id": "hex-grid",
  "kind": "background",
  "tags": {
    "mood": [
      "technical",
      "structured"
    ],
    "content": [
      "infrastructure"
    ]
  },
  "cost": 2,
  "modes": "both",
  "params": {
    "scale": {
      "type": "number",
      "default": 1,
      "minimum": 0.2,
      "maximum": 4
    }
  },
  "conflicts": [],
  "source": "https://threejs.org/examples/",
  "licence": "MIT"
}
