{
  "id": "market-tape",
  "kind": "background",
  "tags": {
    "mood": [
      "energetic",
      "commercial"
    ],
    "content": [
      "metrics",
      "finance"
    ],
    "topic": [
      "money",
      "data"
    ]
  },
  "cost": 2,
  "modes": "both",
  "params": {
    "density": {
      "type": "number",
      "default": 1,
      "minimum": 0.2,
      "maximum": 3
    },
    "speed": {
      "type": "number",
      "default": 0.4,
      "minimum": 0,
      "maximum": 3
    },
    "barWidth": {
      "type": "number",
      "default": 0.06,
      "minimum": 0.02,
      "maximum": 0.4
    },
    "volatility": {
      "type": "number",
      "default": 0.45,
      "minimum": 0,
      "maximum": 1
    },
    "trace": {
      "type": "boolean",
      "default": true
    }
  },
  "conflicts": [],
  "source": "https://threejs.org/examples/#webgl_instancing_performance",
  "licence": "MIT"
}
