{
  "id": "agent-depth",
  "kind": "background",
  "tags": {
    "mood": [
      "technical",
      "uneven"
    ],
    "content": [
      "agents",
      "depth"
    ],
    "topic": [
      "agents"
    ]
  },
  "cost": 3,
  "modes": "both",
  "params": {
    "density": {
      "type": "number",
      "default": 1,
      "minimum": 0.2,
      "maximum": 3
    },
    "wave": {
      "type": "number",
      "default": 0.55,
      "minimum": 0,
      "maximum": 1.5
    },
    "waveSpeed": {
      "type": "number",
      "default": 0.9,
      "minimum": 0,
      "maximum": 3
    }
  },
  "conflicts": [],
  "source": "local",
  "licence": "MIT"
}
