{
  "id": "horizon-gates",
  "kind": "background",
  "tags": {
    "mood": [
      "forward",
      "calm"
    ],
    "content": [
      "timeline",
      "forecast"
    ],
    "topic": [
      "timeline"
    ]
  },
  "cost": 2,
  "modes": "both",
  "params": {
    "density": {
      "type": "number",
      "default": 1,
      "minimum": 0.2,
      "maximum": 3
    },
    "speed": {
      "type": "number",
      "default": 1,
      "minimum": 0,
      "maximum": 3
    }
  },
  "conflicts": [],
  "source": "https://github.com/BlackBeltTechnology/pi-agent-dashboard",
  "licence": "MIT"
}
