{
  "id": "revolve",
  "kind": "transition",
  "tags": {
    "mood": [
      "cinematic",
      "dramatic"
    ],
    "content": [
      "motion"
    ]
  },
  "cost": 2,
  "modes": "both",
  "params": {
    "intensity": {
      "type": "number",
      "default": 1,
      "minimum": 0,
      "maximum": 2
    }
  },
  "conflicts": [],
  "source": "https://threejs.org/examples/",
  "licence": "MIT"
}
