{
  "id": "fab-wafer",
  "kind": "background",
  "tags": {
    "mood": [
      "technical",
      "precise"
    ],
    "content": [
      "supply-chain",
      "silicon"
    ],
    "topic": [
      "compute"
    ]
  },
  "cost": 3,
  "modes": "both",
  "params": {
    "density": {
      "type": "number",
      "default": 1,
      "minimum": 0.2,
      "maximum": 3
    }
  },
  "conflicts": [],
  "source": "local",
  "licence": "MIT"
}
