{
  "id": "starfield",
  "kind": "background",
  "tags": {
    "mood": [
      "space",
      "dramatic"
    ],
    "content": [
      "ambient"
    ]
  },
  "cost": 2,
  "modes": "both",
  "params": {
    "density": {
      "type": "number",
      "default": 0.5,
      "minimum": 0,
      "maximum": 1
    },
    "speed": {
      "type": "number",
      "default": 0.2,
      "minimum": 0,
      "maximum": 2
    }
  },
  "conflicts": [],
  "source": "https://threejs.org/examples/",
  "licence": "MIT"
}
