{
  "id": "sao",
  "kind": "post",
  "tags": {
    "mood": [
      "premium",
      "technical"
    ],
    "content": [
      "staging"
    ]
  },
  "cost": 2,
  "modes": "both",
  "params": {
    "intensity": {
      "type": "number",
      "default": 1,
      "minimum": 0,
      "maximum": 4
    },
    "radius": {
      "type": "number",
      "default": 1,
      "minimum": 0.2,
      "maximum": 3
    }
  },
  "conflicts": [],
  "source": "https://github.com/mrdoob/three.js",
  "licence": "MIT"
}
