{
  "id": "curve-flow",
  "kind": "background",
  "tags": {
    "mood": [
      "kinetic",
      "elegant"
    ],
    "content": [
      "flow",
      "orbit",
      "stream"
    ]
  },
  "cost": 2,
  "modes": "both",
  "params": {
    "density": {
      "type": "number",
      "default": 1,
      "minimum": 0.2,
      "maximum": 3
    },
    "lanes": {
      "type": "number",
      "default": 3,
      "minimum": 1,
      "maximum": 6
    },
    "speed": {
      "type": "number",
      "default": 1,
      "minimum": 0,
      "maximum": 3
    }
  },
  "conflicts": [],
  "source": "https://threejs.org/examples/#webgl_modifier_curve_instanced",
  "licence": "MIT"
}
